{
  "schema_version": "1.0.0",
  "kind": "BenchmarkResult",
  "metadata": {
    "suite_id": "RQB",
    "benchmark_id": "vector-2-aliases",
    "timestamp": "2026-08-06T13:27:00Z"
  },
  "benchmark": {
    "capability": {
      "id": "alias_normalization",
      "display_name": "Alias Normalization"
    },
    "execution_status": "COMPLETED",
    "quality_status": "QUALITY_WARNING",
    "severity": "Critical"
  },
  "measurements": {
    "score": 0.71,
    "confidence": { "lower": 0.36, "upper": 0.92, "level": 0.95 },
    "latency": { "mean_ms": 29.56, "p95_ms": 58.91 }
  },
  "evidence": ["5/7 alias variants resolved canonical target"],
  "provenance": { "git_commit": "e7778802ec", "policy_hash": "ecf5732" },
  "diagnostics": {
    "probable_causes": ["Missing 'pgsql' variant mapping"]
  },
  "recommendations": ["Expand brain-services synonym graph for 'pgsql' mapping"]
}
